<?xml version="1.0" encoding="UTF-8"?>
<testCases xmlns="http://www.omg.org/spec/DMN/20160719/testcase"
	xmlns:xsi="http://www.w3.org/2001/XMLSchema-instance"
	xsi:schemaLocation="http://www.omg.org/spec/DMN/20160719/testcase ../../testCases.xsd">
	<modelName>0003-input-data-string-allowed-values.dmn</modelName>
	<labels>
		<label>base</label>
		<label>simple type</label>
	</labels>
	<testCase id="001"> 
		<description>Testing valid input</description>
		<inputNode name="Employment Status">
			<value>EMPLOYED</value>
		</inputNode>
		<resultNode name="Employment Status Statement" type="decision">
			<computed>
				<value>You are EMPLOYED</value>
			</computed>
		</resultNode>
	</testCase>
	<testCase id="002">
		<description>Testing invalid input</description>
		<!-- is the following number type override valid? -->
		<inputNode name="Employment Status" type="feel:number">
			<value>10</value>
		</inputNode>
		<!-- how do we test for invalid result? -->
	</testCase>
	<testCase id="003">
		<description>Testing value that is not in the allowed values list</description>
		<inputNode name="Employment Status">
			<value>FOO</value>
		</inputNode>
		<!-- how do we test for invalid result? -->
	</testCase>
	
</testCases>
